{
  "$schema": "../execution.schema.json",
  "schemaVersion": 1,
  "operationId": "20260828134634-response-posted-2026-08-28-medium-response-volodymyr-vibecoded-postmortem",
  "action": "response_posted",
  "recordedAt": "2026-08-28T13:46:34Z",
  "executionSurface": "user_initiated_signed_in_medium_ui",
  "initiatedBy": "user",
  "githubIssueNumber": 36,
  "userConfirmation": {
    "obtained": true,
    "confirmedAt": "2026-08-28T13:45:47Z",
    "scope": "Approved."
  },
  "result": {
    "status": "response_posted",
    "candidateId": "2026-08-28-medium-response-volodymyr-vibecoded-postmortem",
    "targetUrl": "https://medium.com/towards-artificial-intelligence/why-my-vibecoded-server-went-down-a-postmortem-5e5be97f44cd",
    "responseUrl": "https://medium.com/@singhaditya21_89007/volodymyr-the-key-number-is-not-1-600-requests-per-minute-it-is-that-27-requests-per-second-could-a6bc6c86129b",
    "verifiedAt": "2026-08-28T13:46:34Z",
    "verification": "Medium rendered the exact approved response under Aditya Singh in the source story response panel; the response count increased from 1 to 2 and the public response permalink is visible."
  },
  "secretsStored": false,
  "githubActionsPerformedMediumAction": false
}
